query_id;iteration;mg;sg;question;truth;full_answer;accuracy;;;;;;;;;;;;;;;
B_01;1;MG1;SG1;How do these facts, together, represent the end-to-end business process?;The set of facts together represents the full retail value chain, from customer demand and sales generation in stores (Shop_Ticket, Traffic_Counter), through order management  (Order,  Historical_Order) and invoicing (Invoice), to inventory control and logistics (Warehouse_Movement, Warehouse_Stock, Third_Party_Warehouse_Stock), enabling analysis of performance, efficiency, and customer behavior across the end-to-end business process.;"Motivation: ""Each fact represents a distinct stage in the retail and distribution business process, forming a complete flow from customer demand, through order and invoicing, to stock management and sales performance tracking. The sequence of related facts—Traffic Counter, Shop Ticket, Order, Invoice, Warehouse Movement, Warehouse Stock, and Third Party Warehouse Stock—covers the entire lifecycle of product movement and sales, supported by shared conformed dimensions like Date, SKU, Store, and Warehouse.""  
Full: ""Together these facts represent the full business process from customer interaction and store traffic (Traffic Counter), through sales at point of sale (Shop Ticket), order creation (Order), invoicing (Invoice), and subsequent warehouse operations and stock monitoring (Warehouse Movement, Warehouse Stock, and Third Party Warehouse Stock). They collectively track the flow of goods from supply through sale, integrating operational and analytical views across the value chain.""  
Structured: ""The facts together represent the complete business process from customer traffic to sales, order management, invoicing, and warehouse operations, describing the end-to-end flow of goods and sales performance.""";0.95;;;;;;;;;;;;;;;
B_01;2;MG1;SG1;How do these facts, together, represent the end-to-end business process?;The set of facts together represents the full retail value chain, from customer demand and sales generation in stores (Shop_Ticket, Traffic_Counter), through order management  (Order,  Historical_Order) and invoicing (Invoice), to inventory control and logistics (Warehouse_Movement, Warehouse_Stock, Third_Party_Warehouse_Stock), enabling analysis of performance, efficiency, and customer behavior across the end-to-end business process.;"Full: ""Together, these facts represent the full sales and distribution process, from product ordering (Order) and invoicing (Invoice) through in-store sales (Shop Ticket), inventory tracking (Warehouse Stock, Third Party Warehouse Stock), and warehouse operations (Warehouse Movement), completed with demand measurement via store traffic (Traffic Counter) and historical tracking (Historical Order).""
Motivation: ""The schema defines each fact as covering a specific phase of the business process: Order and Invoice for order-to-cash, Shop Ticket for retail sales, Warehouse facts for inventory and logistics, Traffic Counter for footfall metrics, and Historical Order for historical analysis, all linked via shared conformed dimensions such as Date, SKU, and Geography.""
Structured: ""They represent the end-to-end sales and logistics process from ordering and invoicing through warehouse management and in-store selling, including stock tracking, traffic measurement, and historical analysis.""";0.98;;;;;;;;;;;;;;;
B_01;3;MG1;SG1;How do these facts, together, represent the end-to-end business process?;The set of facts together represents the full retail value chain, from customer demand and sales generation in stores (Shop_Ticket, Traffic_Counter), through order management  (Order,  Historical_Order) and invoicing (Invoice), to inventory control and logistics (Warehouse_Movement, Warehouse_Stock, Third_Party_Warehouse_Stock), enabling analysis of performance, efficiency, and customer behavior across the end-to-end business process.;"Motivation: ""The series of facts reflects the company’s overall supply chain with sales, logistics, and retail processes. The business process starts with Orders placed by customers, followed by Invoices for the sold goods. Inventory levels are tracked through Warehouse Stock, while movements of goods among warehouses are represented by Warehouse Movement, and stock held at third parties by Third Party Warehouse Stock. Finally, the retail activity is captured by Shop Ticket and customer traffic by Traffic Counter, completing the chain from demand generation to sale execution and physical distribution.""  
Full: ""Together, these facts represent the end-to-end business process from customer demand and order (Order) to invoicing (Invoice), through product distribution and stock management (Warehouse Movement, Warehouse Stock, Third Party Warehouse Stock), concluding with retail sales (Shop Ticket) and customer flow monitoring (Traffic Counter).""  
Structured: ""They describe the full business flow from customer order to invoicing, warehouse logistics, stock management, and retail sales with traffic monitoring.""";0.93;;;;;;;;;;;;;;;
B_01;4;MG1;SG1;How do these facts, together, represent the end-to-end business process?;The set of facts together represents the full retail value chain, from customer demand and sales generation in stores (Shop_Ticket, Traffic_Counter), through order management  (Order,  Historical_Order) and invoicing (Invoice), to inventory control and logistics (Warehouse_Movement, Warehouse_Stock, Third_Party_Warehouse_Stock), enabling analysis of performance, efficiency, and customer behavior across the end-to-end business process.;"Motivation: ""The facts follow the typical retail business cycle. Shop Ticket captures in-store sales, Order records customer orders, Invoice represents billing for those orders, Warehouse Movement and Warehouse Stock monitor goods flow and inventory, Third Party Warehouse Stock extends inventory to external locations, Traffic Counter measures store visits, and Historical Order provides an historical view. Their common conformed dimensions like Date, SKU, Customer, Agent, and Store connect them end to end.""  
Full: ""Together these facts represent the entire business process from customer demand capture through sales and billing to inventory management and warehouse logistics. Traffic Counter tracks store footfall, Shop Ticket manages retail sales, Order records orders received, Invoice manages billing and revenue, and Warehouse Movement and Warehouse Stock track product flows and remaining stock, while Third Party Warehouse Stock extends monitoring to outsourced storage.""  
Structured: ""They represent the end-to-end retail process from demand measurement to sales, invoicing, and stock management across internal and third-party warehouses.""";0.95;;;;;;;;;;;;;;;
B_01;5;MG1;SG1;How do these facts, together, represent the end-to-end business process?;The set of facts together represents the full retail value chain, from customer demand and sales generation in stores (Shop_Ticket, Traffic_Counter), through order management  (Order,  Historical_Order) and invoicing (Invoice), to inventory control and logistics (Warehouse_Movement, Warehouse_Stock, Third_Party_Warehouse_Stock), enabling analysis of performance, efficiency, and customer behavior across the end-to-end business process.;"Motivation: ""The schema shows that the sequence of facts represents different stages of the business process from product ordering to invoicing, shipment, sales, and stock management. Order corresponds to customer orders, Invoice to sales transactions and billing, Shop Ticket to retail sale execution, Warehouse Movement to the physical transfers of goods, and Warehouse Stock and Third Party Warehouse Stock to stock levels. Together, they describe the entire order-to-cash and supply chain cycle tracked over time and by product and location.""  
Full: ""Together, these facts describe the company's end-to-end business process from customer order entry (Order), invoicing and sales (Invoice and Shop Ticket), to goods management and logistics (Warehouse Movement, Warehouse Stock, and Third Party Warehouse Stock), thus covering the full order-to-cash and supply chain cycle.""  
Structured: ""They describe the company's order-to-cash and supply chain cycle from sales orders and invoicing to goods movement and stock management.""";0.87;;;;;;;;;;;;;;;
B_01;1;MG1;SG2;How do these facts, together, represent the end-to-end business process?;The set of facts together represents the full retail value chain, from customer demand and sales generation in stores (Shop_Ticket, Traffic_Counter), through order management  (Order,  Historical_Order) and invoicing (Invoice), to inventory control and logistics (Warehouse_Movement, Warehouse_Stock, Third_Party_Warehouse_Stock), enabling analysis of performance, efficiency, and customer behavior across the end-to-end business process.;"Motivation: ""The facts represent distinct phases of the retail and distribution business process: Orders cover the initial customer purchases, Invoices register the subsequent billing and financial operations, Shop Tickets capture in-store sales, Warehouse Movements record goods transfers, Warehouse Stock and Third Party Warehouse Stock capture inventory positions, Traffic Counter measures store traffic, and Historical Orders provide historical reference data. Together, they describe the entire flow from sales demand to warehouse management and stock monitoring.""
Full: ""These facts together represent the full sales and distribution lifecycle, from customer orders and invoicing to in-store sales, warehouse movements, stock levels in company and third-party warehouses, and store traffic, reflecting the end-to-end business process from demand generation to fulfillment and monitoring.""
Structured: ""They collectively represent the full sales and logistics process from ordering and invoicing through sales execution, warehousing operations, stock control, and performance monitoring.""";0.96;;;;;;;;;;;;;;;
B_01;2;MG1;SG2;How do these facts, together, represent the end-to-end business process?;The set of facts together represents the full retail value chain, from customer demand and sales generation in stores (Shop_Ticket, Traffic_Counter), through order management  (Order,  Historical_Order) and invoicing (Invoice), to inventory control and logistics (Warehouse_Movement, Warehouse_Stock, Third_Party_Warehouse_Stock), enabling analysis of performance, efficiency, and customer behavior across the end-to-end business process.;"Motivation: ""Each fact corresponds to a step in the retail and distribution process, from product ordering to invoicing, warehousing, store operations, and traffic measurement, forming a continuous information flow. Order relates to the purchase phase, Invoice to billing and sales, Warehouse Movement and Warehouse Stock to logistics and inventory management, Shop Ticket to point of sale transactions, Traffic Counter to store visits, and Historical Order and Third Party Warehouse Stock to historical and external stock analysis.""  
Full: ""Together, these facts represent the end-to-end business process from customer order acquisition through invoicing, product distribution, warehousing, and in-store sales up to customer traffic tracking, thus covering the complete retail value chain from supply to demand.""  
Structured: ""They together represent the full retail business process from ordering and invoicing through warehousing and store operations to customer traffic tracking.""";0.9;;;;;;;;;;;;;;;
B_01;3;MG1;SG2;How do these facts, together, represent the end-to-end business process?;The set of facts together represents the full retail value chain, from customer demand and sales generation in stores (Shop_Ticket, Traffic_Counter), through order management  (Order,  Historical_Order) and invoicing (Invoice), to inventory control and logistics (Warehouse_Movement, Warehouse_Stock, Third_Party_Warehouse_Stock), enabling analysis of performance, efficiency, and customer behavior across the end-to-end business process.;"Motivation: ""The set of facts represents different stages and perspectives of the same retail supply and sales process. Orders record customer purchase requests, Invoices record the corresponding billing, Shop Tickets record in-store sales, Warehouse Movements and Stocks record product logistics and inventory levels, Third Party Warehouse Stock monitors external inventory, Historical Orders preserve past sales performance, and Traffic Counter captures in-store traffic useful for performance analysis. Together, they describe the full lifecycle from demand generation to product delivery and sales execution across channels.""
Full: ""These facts together represent the end-to-end retail business process, starting from product ordering and invoicing, through warehouse stock and movement management, to store-level sales and traffic monitoring, including both internal and third-party logistics, capturing all stages from demand to fulfillment and customer purchase.""
Structured: ""They collectively describe the full retail business process from order creation and product shipment to invoicing and store sales, encompassing logistics, inventory, and customer interactions.""";0.95;;;;;;;;;;;;;;;
B_01;4;MG1;SG2;How do these facts, together, represent the end-to-end business process?;The set of facts together represents the full retail value chain, from customer demand and sales generation in stores (Shop_Ticket, Traffic_Counter), through order management  (Order,  Historical_Order) and invoicing (Invoice), to inventory control and logistics (Warehouse_Movement, Warehouse_Stock, Third_Party_Warehouse_Stock), enabling analysis of performance, efficiency, and customer behavior across the end-to-end business process.;"Motivation: ""From the ontology, the facts collectively describe the company’s full order-to-cash and inventory lifecycle: Order facts record sales requests, Invoice facts manage billing, Shop Ticket facts capture retail transactions, Warehouse Movement and Warehouse Stock control logistics and inventory, Third Party Warehouse Stock extends visibility to external warehouses, Traffic Counter measures store visitors, and Historical Order offers long-term analysis. Together, they link sales, distribution, and stock management across time, products, customers, and locations.""
Full: ""These facts together represent the end-to-end business process from sales generation to order fulfillment, invoicing, and warehouse and store operations monitoring, covering how products move from suppliers to stores and customers and how performance is tracked over time.""
Structured: ""They collectively represent the full order-to-cash and stock management process, from orders to invoicing, logistics, retail sales, and inventory control.""";0.85;;;;;;;;;;;;;;;
B_01;5;MG1;SG2;How do these facts, together, represent the end-to-end business process?;The set of facts together represents the full retail value chain, from customer demand and sales generation in stores (Shop_Ticket, Traffic_Counter), through order management  (Order,  Historical_Order) and invoicing (Invoice), to inventory control and logistics (Warehouse_Movement, Warehouse_Stock, Third_Party_Warehouse_Stock), enabling analysis of performance, efficiency, and customer behavior across the end-to-end business process.;"Motivation: ""The entire set of facts represents the flow of goods and information across the retail value chain. Orders and Invoices capture the sales phase, Historical Orders describe past transactional data, Shop Tickets record point-of-sale retail transactions, Warehouse Movements and Warehouse Stock represent inventory flows and balances, Third Party Warehouse Stock tracks outsourced storage, and Traffic Counter supports in-store performance analysis. Together they cover procurement, sales, logistics, stock management, and retail operations, thus modeling the end-to-end business process from store traffic and sales to warehouse logistics and inventory control.""  
Full: ""These facts together describe the end-to-end retail business process, from store customer traffic and sales (Traffic Counter and Shop Ticket) through ordering, billing, and invoicing (Order, Invoice, Historical Order) to warehouse logistics and stock management (Warehouse Movement, Warehouse Stock, Third Party Warehouse Stock), together illustrating the complete flow from customer demand to product delivery and inventory tracking.""  
Structured: ""They mirror the entire retail business process, from customer traffic and sales to order fulfillment, invoicing, and warehouse management.""";1;;;;;;;;;;;;;;;
B_01;1;MG2;SG2;How do these facts, together, represent the end-to-end business process?;The set of facts together represents the full retail value chain, from customer demand and sales generation in stores (Shop_Ticket, Traffic_Counter), through order management  (Order,  Historical_Order) and invoicing (Invoice), to inventory control and logistics (Warehouse_Movement, Warehouse_Stock, Third_Party_Warehouse_Stock), enabling analysis of performance, efficiency, and customer behavior across the end-to-end business process.;"Motivation: ""Each fact models a different stage in the retail and supply chain process, from demand generation to customer fulfillment, showing a coherent flow through sales, logistics, and inventory data. Order captures purchase commitments, Invoice records fulfilled sales, Shop Ticket represents in-store transactions, Warehouse Movement tracks product transfers, Warehouse Stock and Third Party Warehouse Stock monitor inventory levels, Historical Order consolidates trends, and Traffic Counter measures store visitors for conversion analysis. Together, they form an end-to-end view from demand to delivery and performance feedback.""
Full: ""These facts together represent the end-to-end business process from customer demand to product delivery and performance monitoring. Orders record customer purchases, Invoices record billing and fulfillment, Shop Tickets capture in-store sales, Warehouse Movements represent logistics operations, Warehouse and Third Party Warehouse Stock reflect inventory management, Historical Orders store aggregated history for trend analysis, and Traffic Counter measures in-store visitor flow, ensuring a complete supply chain and retail cycle representation.""
Structured: ""They collectively represent the full business cycle from order placement and invoicing through logistics, inventory management, retail sales, and performance analysis.""";1;;;;;;;;;;;;;;;
B_01;2;MG2;SG2;How do these facts, together, represent the end-to-end business process?;The set of facts together represents the full retail value chain, from customer demand and sales generation in stores (Shop_Ticket, Traffic_Counter), through order management  (Order,  Historical_Order) and invoicing (Invoice), to inventory control and logistics (Warehouse_Movement, Warehouse_Stock, Third_Party_Warehouse_Stock), enabling analysis of performance, efficiency, and customer behavior across the end-to-end business process.;"Motivation: ""Each fact covers a stage of the company’s commercial and logistical cycle. Shop Ticket tracks point-of-sale transactions, Invoice registers billed sales, Order captures customer purchase requests, Historical Order consolidates long-term order history, Warehouse Movement records product transfers, Warehouse Stock and Third Party Warehouse Stock measure stock levels, and Traffic Counter analyzes store footfall. Together, they represent the full flow from demand generation and sales to product movement, inventory control, and retail performance monitoring.""  
Full: ""Taken together, these facts model the entire value chain from customer demand and order creation through invoicing, warehouse operations, stock management, and in-store performance tracking, providing end-to-end visibility of the business process from sales to fulfillment.""  
Structured: ""Together they represent the end-to-end sales and supply chain process from order capture and invoicing through warehousing, inventory management, and store operations.""";0.92;;;;;;;;;;;;;;;
B_01;3;MG2;SG2;How do these facts, together, represent the end-to-end business process?;The set of facts together represents the full retail value chain, from customer demand and sales generation in stores (Shop_Ticket, Traffic_Counter), through order management  (Order,  Historical_Order) and invoicing (Invoice), to inventory control and logistics (Warehouse_Movement, Warehouse_Stock, Third_Party_Warehouse_Stock), enabling analysis of performance, efficiency, and customer behavior across the end-to-end business process.;"Motivation: ""The facts represent sequential phases of the company's retail and supply chain activities, starting from product inflow and storage, followed by order creation, invoicing, in-store sales, and customer traffic monitoring, thus forming a complete end-to-end business process from procurement to sales performance analysis.""  
Full: ""Together, these facts capture the company’s end-to-end business process: Warehouse and Third-Party Warehouse Stock monitor inventory levels; Warehouse Movement tracks stock transfers; Order and Historical Order represent customer purchase requests; Invoice covers billing and revenue; Shop Ticket records retail sales; and Traffic Counter measures customer flow, completing the cycle from supply chain operations through sales execution and performance monitoring.""  
Structured: ""They represent the full business process from inbound logistics and stock management through order processing and invoicing to retail sales and customer traffic analysis.""";1;;;;;;;;;;;;;;;
B_01;4;MG2;SG2;How do these facts, together, represent the end-to-end business process?;The set of facts together represents the full retail value chain, from customer demand and sales generation in stores (Shop_Ticket, Traffic_Counter), through order management  (Order,  Historical_Order) and invoicing (Invoice), to inventory control and logistics (Warehouse_Movement, Warehouse_Stock, Third_Party_Warehouse_Stock), enabling analysis of performance, efficiency, and customer behavior across the end-to-end business process.;"Full: ""The set of facts together cover the end-to-end business process from demand generation to fulfillment and after-sales: Orders register sales commitments, Invoices record executed sales and revenue, Shop Tickets capture in-store transactions, Warehouse Movements and Stocks track product logistics and inventory levels, Traffic Counters measure store traffic and conversion, and Historical Orders provide long-term trend analysis, thus closing the full supply, sales, and performance cycle.""
Motivation: ""Each fact models a distinct phase of the value chain: Order for order entry, Invoice for billing, Shop Ticket for retail sales, Warehouse Movement and Stock for logistics and inventory, Traffic Counter for store activity, and Historical Order for strategic analysis, together representing the full business process lifecycle.""
Structured: ""Together they describe the full business flow from order creation through invoicing and delivery to stock management and sales performance analysis.""";1;;;;;;;;;;;;;;;
B_01;5;MG2;SG2;How do these facts, together, represent the end-to-end business process?;The set of facts together represents the full retail value chain, from customer demand and sales generation in stores (Shop_Ticket, Traffic_Counter), through order management  (Order,  Historical_Order) and invoicing (Invoice), to inventory control and logistics (Warehouse_Movement, Warehouse_Stock, Third_Party_Warehouse_Stock), enabling analysis of performance, efficiency, and customer behavior across the end-to-end business process.;"Full: ""Together, these facts describe the complete business process from product procurement and stock management, through warehouse movements and third-party logistics, to order placement, invoicing, and final retail sales, with intermediate tracking of inventory and store traffic for operational and performance analysis.""
Motivation: ""The ontology contains facts covering the entire business lifecycle: Warehouse Stock and Third Party Warehouse Stock manage inventory status, Warehouse Movement tracks goods flow, Order and Historical Order register purchases, Invoice records billing, Shop Ticket covers retail transactions, and Traffic Counter measures in-store activity; this sequence represents the end-to-end business process.""
Structured: ""They represent the full business cycle from inventory and warehousing through orders, invoicing, and retail sales, including logistics and store traffic monitoring.""";0.88;;;;;;;;;;;;;;;
